{
  "name": "Exponential (exponential)",
  "label": "Exponential",
  "bore_type": "exponential",
  "bore_length_mm": 1027.92,
  "n_holes": 7,
  "hole_positions_mm": [
    87.07,
    175.6,
    265.57,
    357.0,
    449.88,
    544.21,
    639.99
  ],
  "hole_diameters_mm": [],
  "hole_offsets": [
    79.43,
    35.57
  ],
  "bore_profile": [
    {
      "position_mm": 0.0,
      "radius_mm": 18.71
    },
    {
      "position_mm": 205.584,
      "radius_mm": 19.009
    },
    {
      "position_mm": 411.168,
      "radius_mm": 19.312
    },
    {
      "position_mm": 616.752,
      "radius_mm": 19.62
    },
    {
      "position_mm": 822.336,
      "radius_mm": 19.933
    },
    {
      "position_mm": 1027.92,
      "radius_mm": 20.251
    }
  ],
  "optimized_params": {
    "radius_start_mm": 18.7104,
    "radius_end_mm": 20.2511
  },
  "fundamental_hz": 83.27,
  "best_scale": "pentatonic_major",
  "scale_rms_cents": 0.0,
  "resonances_hz": [
    83.27,
    83.27,
    83.27,
    93.47,
    93.47,
    102.31,
    116.65,
    137.77
  ],
  "initial_cost_rms_cents": 206.815,
  "final_cost_rms_cents": 0.0,
  "total_time_s": 44.326,
  "target_frequencies": null,
  "notes": ""
}